{
  "mod": "mss",
  "reviewed": true,
  "structureSets": [
    "mss:arena",
    "mss:birch_river",
    "mss:calcite_house",
    "mss:castle_ruin",
    "mss:castle_tower",
    "mss:cherry_river",
    "mss:desert_pyramid",
    "mss:desert_well",
    "mss:diorite_house",
    "mss:frozen_pond",
    "mss:jungle",
    "mss:large_tower",
    "mss:leaf_hollow",
    "mss:mangrove",
    "mss:muddy_water_hole",
    "mss:mushroom",
    "mss:nether_portal",
    "mss:palm_island",
    "mss:red_sand",
    "mss:small_deepslate_house",
    "mss:small_oak_house",
    "mss:small_pond",
    "mss:small_tower",
    "mss:spruce_huts",
    "mss:taiga",
    "mss:trees",
    "mss:volcano",
    "mss:white_house"
  ],
  "structures": [
    {
      "id": "mss:arena",
      "set": "mss:arena",
      "size": {
        "x": 137,
        "y": 121,
        "z": 162
      },
      "mood": [],
      "climate": [],
      "depth": []
    },
    {
      "id": "mss:birch_river",
      "set": "mss:birch_river",
      "size": {
        "x": 35,
        "y": 35,
        "z": 33
      },
      "mood": [],
      "climate": [],
      "depth": []
    },
    {
      "id": "mss:calcite_house",
      "set": "mss:calcite_house",
      "size": {
        "x": 25,
        "y": 48,
        "z": 24
      },
      "mood": [],
      "climate": [],
      "depth": []
    },
    {
      "id": "mss:castle_ruin",
      "set": "mss:castle_ruin",
      "size": {
        "x": 40,
        "y": 35,
        "z": 43
      },
      "mood": [],
      "climate": [],
      "depth": []
    },
    {
      "id": "mss:castle_tower",
      "set": "mss:castle_tower",
      "size": {
        "x": 29,
        "y": 63,
        "z": 31
      },
      "mood": [],
      "climate": [],
      "depth": []
    },
    {
      "id": "mss:cherry_river",
      "set": "mss:cherry_river",
      "size": {
        "x": 31,
        "y": 38,
        "z": 31
      },
      "mood": [],
      "climate": [],
      "depth": []
    },
    {
      "id": "mss:desert_pyramid",
      "set": "mss:desert_pyramid",
      "size": {
        "x": 48,
        "y": 63,
        "z": 53
      },
      "mood": [],
      "climate": [],
      "depth": []
    },
    {
      "id": "mss:desert_well",
      "set": "mss:desert_well",
      "size": {
        "x": 26,
        "y": 44,
        "z": 26
      },
      "mood": [],
      "climate": [],
      "depth": []
    },
    {
      "id": "mss:diorite_house",
      "set": "mss:diorite_house",
      "size": {
        "x": 58,
        "y": 96,
        "z": 60
      },
      "mood": [],
      "climate": [],
      "depth": []
    },
    {
      "id": "mss:frozen_pond",
      "set": "mss:frozen_pond",
      "size": {
        "x": 36,
        "y": 38,
        "z": 35
      },
      "mood": [],
      "climate": [],
      "depth": []
    },
    {
      "id": "mss:jungle",
      "set": "mss:jungle",
      "size": {
        "x": 73,
        "y": 58,
        "z": 78
      },
      "mood": [],
      "climate": [],
      "depth": []
    },
    {
      "id": "mss:large_tower",
      "set": "mss:large_tower",
      "size": {
        "x": 59,
        "y": 113,
        "z": 68
      },
      "mood": [],
      "climate": [],
      "depth": []
    },
    {
      "id": "mss:leaf_hollow",
      "set": "mss:leaf_hollow",
      "size": {
        "x": 73,
        "y": 30,
        "z": 86
      },
      "mood": [],
      "climate": [],
      "depth": []
    },
    {
      "id": "mss:mangrove",
      "set": "mss:mangrove",
      "size": {
        "x": 32,
        "y": 68,
        "z": 40
      },
      "mood": [],
      "climate": [],
      "depth": []
    },
    {
      "id": "mss:muddy_water_hole",
      "set": "mss:muddy_water_hole",
      "size": {
        "x": 63,
        "y": 61,
        "z": 56
      },
      "mood": [],
      "climate": [],
      "depth": []
    },
    {
      "id": "mss:mushroom",
      "set": "mss:mushroom",
      "size": {
        "x": 35,
        "y": 27,
        "z": 30
      },
      "mood": [],
      "climate": [],
      "depth": []
    },
    {
      "id": "mss:nether_portal",
      "set": "mss:nether_portal",
      "size": {
        "x": 35,
        "y": 27,
        "z": 25
      },
      "mood": [],
      "climate": [],
      "depth": []
    },
    {
      "id": "mss:palm_island",
      "set": "mss:palm_island",
      "size": {
        "x": 14,
        "y": 38,
        "z": 13
      },
      "mood": [],
      "climate": [],
      "depth": []
    },
    {
      "id": "mss:red_sand",
      "set": "mss:red_sand",
      "size": {
        "x": 48,
        "y": 35,
        "z": 63
      },
      "mood": [],
      "climate": [],
      "depth": []
    },
    {
      "id": "mss:small_deepslate_house",
      "set": "mss:small_deepslate_house",
      "size": {
        "x": 32,
        "y": 37,
        "z": 34
      },
      "mood": [],
      "climate": [],
      "depth": []
    },
    {
      "id": "mss:small_oak_house",
      "set": "mss:small_oak_house",
      "size": {
        "x": 29,
        "y": 48,
        "z": 35
      },
      "mood": [],
      "climate": [],
      "depth": []
    },
    {
      "id": "mss:small_pond",
      "set": "mss:small_pond",
      "size": {
        "x": 20,
        "y": 40,
        "z": 20
      },
      "mood": [],
      "climate": [],
      "depth": []
    },
    {
      "id": "mss:small_tower",
      "set": "mss:small_tower",
      "size": {
        "x": 33,
        "y": 48,
        "z": 38
      },
      "mood": [],
      "climate": [],
      "depth": []
    },
    {
      "id": "mss:spruce_huts",
      "set": "mss:spruce_huts",
      "size": {
        "x": 32,
        "y": 38,
        "z": 31
      },
      "mood": [],
      "climate": [],
      "depth": []
    },
    {
      "id": "mss:taiga",
      "set": "mss:taiga",
      "size": {
        "x": 45,
        "y": 58,
        "z": 42
      },
      "mood": [],
      "climate": [],
      "depth": []
    },
    {
      "id": "mss:tree_1",
      "set": "mss:trees",
      "size": {
        "x": 13,
        "y": 22,
        "z": 13
      },
      "mood": [],
      "climate": [],
      "depth": []
    },
    {
      "id": "mss:tree_2",
      "set": "mss:trees",
      "size": {
        "x": 17,
        "y": 25,
        "z": 17
      },
      "mood": [],
      "climate": [],
      "depth": []
    },
    {
      "id": "mss:tree_3",
      "set": "mss:trees",
      "size": {
        "x": 20,
        "y": 30,
        "z": 21
      },
      "mood": [],
      "climate": [],
      "depth": []
    },
    {
      "id": "mss:tree_4",
      "set": "mss:trees",
      "size": {
        "x": 21,
        "y": 30,
        "z": 20
      },
      "mood": [],
      "climate": [],
      "depth": []
    },
    {
      "id": "mss:tree_5",
      "set": "mss:trees",
      "size": {
        "x": 25,
        "y": 31,
        "z": 20
      },
      "mood": [],
      "climate": [],
      "depth": []
    },
    {
      "id": "mss:tree_6",
      "set": "mss:trees",
      "size": {
        "x": 20,
        "y": 28,
        "z": 20
      },
      "mood": [],
      "climate": [],
      "depth": []
    },
    {
      "id": "mss:tree_7",
      "set": "mss:trees",
      "size": {
        "x": 20,
        "y": 40,
        "z": 20
      },
      "mood": [],
      "climate": [],
      "depth": []
    },
    {
      "id": "mss:tree_8",
      "set": "mss:trees",
      "size": {
        "x": 20,
        "y": 40,
        "z": 20
      },
      "mood": [],
      "climate": [],
      "depth": []
    },
    {
      "id": "mss:volcano",
      "set": "mss:volcano",
      "size": {
        "x": 98,
        "y": 78,
        "z": 93
      },
      "mood": [],
      "climate": [],
      "depth": []
    },
    {
      "id": "mss:white_house",
      "set": "mss:white_house",
      "size": {
        "x": 63,
        "y": 96,
        "z": 58
      },
      "mood": [],
      "climate": [],
      "depth": []
    }
  ],
  "features": [],
  "spawns": [],
  "mixins": [],
  "registries": []
}
